{"cases":[{"case_id":"N17","contract_path":"cases/N17/contract.json","contract_sha256":"76cc222b889b7fa246e93a716d0ff935c63765b25b44cdaa94d0ffb70eed9272","gold_path":"cases/N17/gold.json","gold_sha256":"d1b65bb0cc589afaca19e6b5ba85bf0b656bd9365782f5c877ab296eab13e92f","manifest_path":"cases/N17/manifest.json","manifest_sha256":"0c7d962889a5bb921f9f0c4d3412d1a31b249074d997a25941b35f1a35549c22","task_path":"cases/N17/task.json","task_sha256":"284d7188bf295a64033b663747124e53296d68d015ce0f27fbf97375b52fb4c5"},{"case_id":"R23","contract_path":"cases/R23/contract.json","contract_sha256":"7b972d2ef734f47666d542a55451a5a192d23687728cafe314361266bdb35229","gold_path":"cases/R23/gold.json","gold_sha256":"6248e2c26e0d60a51c3544504c0e418fda305bcfc6499372a43b6cb20aadd021","manifest_path":"cases/R23/manifest.json","manifest_sha256":"4b255bdf1b3d1ecc882b79ebc48ac562ef0355c977046cc04bf48954d9549c1e","task_path":"cases/R23/task.json","task_sha256":"29b290c7fe848ad58c06079a11279d908001ce6379a998c1dfe341ceb3bbc1a2"},{"case_id":"S01","contract_path":"cases/S01/contract.json","contract_sha256":"b7b7ce62e522171f84566082d9e7e74d57c28af9bc38130baced2489772a8880","gold_path":"cases/S01/gold.json","gold_sha256":"ead302f55b865ff2ec8eacd4d646d28ebb0c5ba21b2900bef260e7058f32e8b5","manifest_path":"cases/S01/manifest.json","manifest_sha256":"7e6a0a8a52058b1c17b8678d041bbebcd4490d790992334e83f2c480a041efc2","task_path":"cases/S01/task.json","task_sha256":"ca5c76089cf49533da585d74d4e4d2cda1b73a1b3a8f5bfa22a43ab409cead88"}],"content_sha256":"2e8552dd86e423011fc9f5b4ad046e27fbdd1a6d96c7d926de7bfa8109c9390a","families":[],"schema_version":"1","suite_id":"suite_83ec246624ac3b37bb9f7b12"}